{
  "$schema": "https://json-schema.org/draft/2020-12/schema",
  "$id": "botville/venues.schema.json",
  "title": "Published venue vocabulary",
  "description": "Emitted by scripts/world-bake.mjs. BotVille is the only authority (I-8). roles/affords/hours per the 2026-07-29 addendum I.1.",
  "type": "array",
  "minItems": 1,
  "items": {
    "type": "object",
    "additionalProperties": false,
    "required": ["id", "label", "indoor", "capacity", "archetype", "roles", "affords", "hours"],
    "properties": {
      "id": { "type": "string", "minLength": 1 },
      "label": { "type": "string", "minLength": 1 },
      "indoor": { "type": "boolean" },
      "capacity": { "type": "integer", "minimum": 0 },
      "archetype": { "type": "string", "minLength": 1 },
      "roles": {
        "type": "array",
        "items": { "enum": ["home", "work", "hangout"] },
        "uniqueItems": true
      },
      "affords": {
        "type": "array",
        "minItems": 1,
        "items": { "enum": ["sleep", "read", "eat", "work", "socialize", "wander", "idle"] },
        "uniqueItems": true
      },
      "hours": {
        "type": "array",
        "minItems": 1,
        "items": {
          "type": "object",
          "additionalProperties": false,
          "required": ["open", "close"],
          "properties": {
            "open": { "type": "integer", "minimum": 0, "maximum": 23 },
            "close": { "type": "integer", "minimum": 1, "maximum": 24 }
          }
        }
      }
    }
  }
}
